{
  "schema_version": "1.0",
  "provider_model_profile_id": "provider-model:poolside-laguna-s-2.1",
  "provider_profile_id": "provider-profile:poolside-direct-laguna-s-2.1",
  "provider_profile_digest": "sha256:2b10c6515c272c61a33193a2607cd198433fdaa8a5abd018ad2cc215e829a0ca",
  "child_contract_id": "STUDIO-009P-04",
  "child_contract_digest": "sha256:d1c3838be32a75edaed7e573b6027e2b92592f21ad63c7f842a45882dcffcfe2",
  "model_identity_ref": "model-id:poolside/laguna-s-2.1",
  "model_version_policy_ref": "model-policy:exact-poolside-laguna-s-2.1",
  "allowed_data_classifications": [
    "PUBLIC"
  ],
  "max_request_bytes": 32768,
  "max_output_bytes": 131072,
  "owner_approval_ref": "owner-approval:studio-009p-04-contract",
  "status": "DECLARED",
  "not_before": "2026-09-09T05:32:06Z",
  "expires_at": "2027-09-09T05:32:06Z",
  "as_of": "2026-09-09T05:32:10Z",
  "canonical_digest": "sha256:3a71cf60565b1bc2e2339fdb08e7e070227ae715b93b8629de308fe94595e07a"
}
