{
  "schema_version": "1.0",
  "provider_model_profile_id": "provider-model:groq-gpt-oss-120b",
  "provider_profile_id": "provider-profile:groq-free-gpt-oss-120b",
  "provider_profile_digest": "sha256:a2b53e4933d01da5ef3a1d58749975aec2e4efb0bc9839cd3d870a78a23f9d5b",
  "child_contract_id": "STUDIO-009P-01",
  "child_contract_digest": "sha256:8f5b6c679c7dfbec15d63f8d750bc9b404bb46cb99efe62ea47c2a16e543f98f",
  "model_identity_ref": "model-id:openai/gpt-oss-120b",
  "model_version_policy_ref": "model-policy:exact-openai-gpt-oss-120b",
  "allowed_data_classifications": [
    "PUBLIC"
  ],
  "max_request_bytes": 131072,
  "max_output_bytes": 65536,
  "owner_approval_ref": "owner-approval:studio-009p-01-contract",
  "status": "DECLARED",
  "not_before": "2026-09-03T10:22:15Z",
  "expires_at": "2027-09-03T10:22:15Z",
  "as_of": "2026-09-03T10:23:00Z",
  "canonical_digest": "sha256:7499e600323b5c544ac8fce35ac9c575ad244e6a97f01e625d845e161c064327"
}
